{
  "contractVersion": "1.1.0-fixture",
  "clientSubmissionId": "f6ad3167-fce0-4bf3-89e7-2e46b377c9fb",
  "week": 2,
  "wantedToShare": "yes",
  "intendedAudience": "friend",
  "sharingAction": "chose_private",
  "expectedComfort": 2,
  "anticipatedJudgment": "yes",
  "supportConfidence": 3,
  "concernCategory": "personal_insecurity",
  "completedAt": "2026-10-04T12:00:00Z"
}
